{
	"name": "色图评分fork版",
	"link": "https://github.com/GaryDu0123/SetuScore",
	"authors": [
		{
			"name": "@GaryDu0123",
			"link": "https://github.com/GaryDu0123"
		}
	],
	"description": "对[原仓库](https://github.com/pcrbot/SetuScore)进行了修改, 保持色图评分的常态开启, 评分高于一定值才会进行提示, 添加了可调整的阈值禁言",
	"last_updated": 1728527189,
	"stars": 1
}