{
	"name": "HosBotManagerWeb",
	"link": "https://github.com/pcrbot/HosBotManagerWeb",
	"authors": [
		{
			"name": "@LQBing",
			"link": "https://github.com/LQBing"
		},
		{
			"name": "@shewinder",
			"link": "https://github.com/shewinder"
		}
	],
	"description": "由[网页开关](https://github.com/pcrbot/plugins-for-Hoshino/tree/master/shebot/webServiceManager)修改而来的hoshinobot服务管理网页版，支持多cq端",
	"last_updated": 1746771920,
	"stars": 46
}