{
	"name": "Ai绘图/以图绘图",
	"link": "https://github.com/CYDXDianXian/AI_image_gen",
	"authors": [
		{
			"name": "@穿越电线",
			"link": "https://github.com/CYDXDianXian"
		},
		{
			"name": "@sanshanya",
			"link": "https://github.com/sanshanya"
		}
	],
	"description": "通过tag生成图片，以图生图，XP查询，每日上限与频率限制，群黑/白名单，自动屏蔽超级大群，设置屏蔽词tag等功能",
	"last_updated": 1669015184,
	"stars": 92
}